{
  "contract_version": "1.0",
  "query_id": "00000000-0000-0000-0000-000000000001",
  "responding_module": "ti",
  "entity": {
    "type": "hash_sha256",
    "value": "275a021bbfb6489e54d471899f7db9d1663fc695ec2fe2a2c4538aabf651fd0f"
  },
  "verdict": "CONFIRMED",
  "severity": "CRITICAL",
  "mitre": [],
  "justification": "VirusTotal: 45/72 engines flagged as malicious (severity=CRITICAL)",
  "evidence": [
    {
      "source_file": "virustotal",
      "line": 1,
      "content": "VT detections: 45/72 engines flagged as malicious",
      "verbatim": true,
      "timestamp": "2023-11-14T22:13:20Z"
    },
    {
      "source_file": "virustotal",
      "line": 2,
      "content": "VT tags: trojan, windows",
      "verbatim": true
    },
    {
      "source_file": "virustotal",
      "line": 3,
      "content": "Threat label: trojan.generic/emotet",
      "verbatim": true
    },
    {
      "source_file": "virustotal",
      "line": 4,
      "content": "First submitted: 2023-07-22T04:26:40Z",
      "verbatim": true,
      "timestamp": "2023-07-22T04:26:40Z"
    }
  ],
  "related_entities": [],
  "cost": {
    "llm_calls": 0,
    "tokens_in": 0,
    "tokens_out": 0
  }
}