{
  "contract_version": "1.0",
  "query_id": "00000000-0000-0000-0000-000000000002",
  "responding_module": "ti",
  "entity": {
    "type": "hash_sha256",
    "value": "aabbccddeeff00112233445566778899aabbccddeeff00112233445566778899"
  },
  "verdict": "INCONCLUSIVE",
  "severity": null,
  "mitre": [],
  "justification": "VirusTotal: 2/80 engines flagged \u2014 low confidence",
  "evidence": [
    {
      "source_file": "virustotal",
      "line": 1,
      "content": "VT detections: 2/80 engines flagged as malicious",
      "verbatim": true,
      "timestamp": "2023-11-14T22:13:20Z"
    }
  ],
  "related_entities": [],
  "cost": {
    "llm_calls": 0,
    "tokens_in": 0,
    "tokens_out": 0
  }
}