{
  "contract_version": "1.0",
  "query_id": "00000000-0000-0000-0000-000000000003",
  "responding_module": "ti",
  "entity": {
    "type": "ip",
    "value": "8.8.8.8"
  },
  "verdict": "NOT_FOUND",
  "severity": null,
  "mitre": [],
  "justification": "VirusTotal: no malicious detections or no record found",
  "evidence": [
    {
      "source_file": "virustotal",
      "line": 1,
      "content": "VT detections: 0/90 engines flagged as malicious",
      "verbatim": true,
      "timestamp": "2023-11-14T22:13:20Z"
    },
    {
      "source_file": "virustotal",
      "line": 2,
      "content": "Geolocation: country=US, AS=Google LLC",
      "verbatim": true
    }
  ],
  "related_entities": [],
  "cost": {
    "llm_calls": 0,
    "tokens_in": 0,
    "tokens_out": 0
  }
}