{
  "contract_version": "1.0",
  "query_id": "00000000-0000-0000-0000-000000000008",
  "responding_module": "ti",
  "entity": {
    "type": "hash_sha256",
    "value": "deadbeefdeadbeefdeadbeefdeadbeefdeadbeefdeadbeefdeadbeefdeadbeef"
  },
  "verdict": "NOT_FOUND",
  "severity": null,
  "mitre": [],
  "justification": "VT_API_KEY not configured",
  "evidence": [],
  "related_entities": [],
  "cost": {
    "llm_calls": 0,
    "tokens_in": 0,
    "tokens_out": 0
  }
}