{
  "contract_version": "1.0",
  "query_id": "00000000-0000-0000-0000-000000000004",
  "responding_module": "ti",
  "entity": {
    "type": "domain",
    "value": "evil-c2-server.top"
  },
  "verdict": "CONFIRMED",
  "severity": "HIGH",
  "mitre": [],
  "justification": "VirusTotal: 15/90 engines flagged as malicious (severity=HIGH)",
  "evidence": [
    {
      "source_file": "virustotal",
      "line": 1,
      "content": "VT detections: 15/90 engines flagged as malicious",
      "verbatim": true,
      "timestamp": "2023-11-14T22:13:20Z"
    },
    {
      "source_file": "virustotal",
      "line": 2,
      "content": "VT tags: c2, malware",
      "verbatim": true
    }
  ],
  "related_entities": [
    {
      "type": "hash_sha256",
      "value": "aaaa1111bbbb2222cccc3333dddd4444eeee5555ffff6666aaaa1111bbbb2222",
      "relationship": "communicating files"
    },
    {
      "type": "hash_sha256",
      "value": "1111aaaa2222bbbb3333cccc4444dddd5555eeee6666ffff1111aaaa2222bbbb",
      "relationship": "communicating files"
    }
  ],
  "cost": {
    "llm_calls": 0,
    "tokens_in": 0,
    "tokens_out": 0
  }
}